{
  "metadata": {
    "source_standard_query": "knowledge/standard_query/QUERY001.json",
    "profile_builder_version": "M7.3-P1",
    "profile_schema_version": "1.0",
    "profile_config_version": "1.0",
    "generated_at": "2026-07-23T16:13:58.574502+00:00"
  },
  "query_id": "QUERY001",
  "product_profile": "DEFAULT",
  "filter": [
    {
      "field": "organization.product",
      "values": [
        "产品A"
      ],
      "source": "NORMALIZED",
      "confidence": 1.0,
      "completeness": 1.0,
      "base_weight": 1.0,
      "effective_weight": 1.0,
      "evidence_type": "",
      "filter_mode": "SOFT"
    },
    {
      "field": "organization.ipmt",
      "values": [
        "IPMT-A"
      ],
      "source": "NORMALIZED",
      "confidence": 1.0,
      "completeness": 1.0,
      "base_weight": 0.8,
      "effective_weight": 0.8,
      "evidence_type": "",
      "filter_mode": "PREFER"
    },
    {
      "field": "organization.spdt",
      "values": [
        "SPDT-A"
      ],
      "source": "NORMALIZED",
      "confidence": 1.0,
      "completeness": 1.0,
      "base_weight": 0.9,
      "effective_weight": 0.9,
      "evidence_type": "",
      "filter_mode": "PREFER"
    },
    {
      "field": "organization.responsible_department_level2",
      "values": [
        "软件部"
      ],
      "source": "NORMALIZED",
      "confidence": 1.0,
      "completeness": 1.0,
      "base_weight": 0.6,
      "effective_weight": 0.6,
      "evidence_type": "",
      "filter_mode": "PREFER"
    },
    {
      "field": "organization.domain",
      "values": [
        "通信"
      ],
      "source": "NORMALIZED",
      "confidence": 1.0,
      "completeness": 1.0,
      "base_weight": 0.7,
      "effective_weight": 0.7,
      "evidence_type": "",
      "filter_mode": "SOFT"
    },
    {
      "field": "classification.cause_level1",
      "values": [
        "软件设计"
      ],
      "source": "NORMALIZED",
      "confidence": 0.62,
      "completeness": 1.0,
      "base_weight": 0.55,
      "effective_weight": 0.341,
      "evidence_type": "INFERRED",
      "filter_mode": "EXPANDABLE"
    },
    {
      "field": "classification.cause_level2",
      "values": [
        "资源管理"
      ],
      "source": "NORMALIZED",
      "confidence": 0.55,
      "completeness": 1.0,
      "base_weight": 0.45,
      "effective_weight": 0.2475,
      "evidence_type": "INFERRED",
      "filter_mode": "EXPANDABLE"
    }
  ],
  "high_weight": [
    {
      "field": "problem.failure_objects",
      "values": [
        "消息接收处理模块"
      ],
      "source": "INFERRED",
      "confidence": 0.35,
      "completeness": 1.0,
      "base_weight": 1.0,
      "effective_weight": 0.238,
      "evidence_type": ""
    },
    {
      "field": "problem.phenomena",
      "values": [
        "消息处理拥堵",
        "系统重启"
      ],
      "source": "INFERRED",
      "confidence": 0.35,
      "completeness": 1.0,
      "base_weight": 1.0,
      "effective_weight": 0.238,
      "evidence_type": ""
    },
    {
      "field": "problem.trigger_conditions",
      "values": [
        "高负载消息输入"
      ],
      "source": "INFERRED",
      "confidence": 0.35,
      "completeness": 1.0,
      "base_weight": 0.9,
      "effective_weight": 0.2142,
      "evidence_type": ""
    },
    {
      "field": "problem.standard_problem_description",
      "values": [
        "系统在高负载消息输入条件下出现处理拥堵，随后触发保护性重启。"
      ],
      "source": "INFERRED",
      "confidence": 0.95,
      "completeness": 1.0,
      "base_weight": 0.95,
      "effective_weight": 0.6137,
      "evidence_type": "SUMMARIZED"
    },
    {
      "field": "problem.problem_description",
      "values": [
        "CAN报文过多时软件异常重启"
      ],
      "source": "NORMALIZED",
      "confidence": 1.0,
      "completeness": 1.0,
      "base_weight": 0.85,
      "effective_weight": 0.85,
      "evidence_type": ""
    }
  ],
  "medium_weight": [
    {
      "field": "analysis.failure_mechanisms",
      "values": [
        "输入速率持续高于处理速率导致队列堆积并触发保护重启"
      ],
      "source": "INFERRED",
      "confidence": 0.35,
      "completeness": 1.0,
      "base_weight": 0.8,
      "effective_weight": 0.1904,
      "evidence_type": ""
    },
    {
      "field": "analysis.trc",
      "values": [
        "消息接收缺少有效流量控制或队列保护"
      ],
      "source": "INFERRED",
      "confidence": 0.72,
      "completeness": 1.0,
      "base_weight": 0.7,
      "effective_weight": 0.34272,
      "evidence_type": "INFERRED"
    },
    {
      "field": "analysis.root_causes",
      "values": [
        "高负载场景下处理能力与输入速率不匹配"
      ],
      "source": "INFERRED",
      "confidence": 0.35,
      "completeness": 1.0,
      "base_weight": 0.65,
      "effective_weight": 0.1547,
      "evidence_type": ""
    },
    {
      "field": "analysis.cause_description",
      "values": [
        "接收队列拥堵导致任务阻塞"
      ],
      "source": "NORMALIZED",
      "confidence": 1.0,
      "completeness": 1.0,
      "base_weight": 0.6,
      "effective_weight": 0.6,
      "evidence_type": ""
    },
    {
      "field": "problem.impacts",
      "values": [
        "业务处理中断"
      ],
      "source": "INFERRED",
      "confidence": 0.35,
      "completeness": 1.0,
      "base_weight": 0.5,
      "effective_weight": 0.119,
      "evidence_type": ""
    }
  ],
  "low_weight": [
    {
      "field": "knowledge.keywords",
      "values": [
        "高负载",
        "消息拥堵",
        "队列堆积",
        "重启"
      ],
      "source": "DIRECT",
      "confidence": 1.0,
      "completeness": 1.0,
      "base_weight": 0.35,
      "effective_weight": 0.35,
      "evidence_type": ""
    },
    {
      "field": "knowledge.tags",
      "values": [
        "性能",
        "稳定性",
        "流量控制"
      ],
      "source": "DIRECT",
      "confidence": 1.0,
      "completeness": 1.0,
      "base_weight": 0.25,
      "effective_weight": 0.25,
      "evidence_type": ""
    },
    {
      "field": "solution.solution_object",
      "values": [
        "消息接收队列"
      ],
      "source": "INFERRED",
      "confidence": 0.66,
      "completeness": 1.0,
      "base_weight": 0.2,
      "effective_weight": 0.08976,
      "evidence_type": "INFERRED"
    },
    {
      "field": "solution.solution_mechanism",
      "values": [
        "限流与削峰缓冲"
      ],
      "source": "INFERRED",
      "confidence": 0.64,
      "completeness": 1.0,
      "base_weight": 0.2,
      "effective_weight": 0.08704,
      "evidence_type": "INFERRED"
    }
  ],
  "channels": {
    "keyword": [
      "problem.failure_objects",
      "problem.phenomena",
      "problem.trigger_conditions",
      "problem.standard_problem_description",
      "problem.problem_description",
      "analysis.failure_mechanisms",
      "analysis.trc",
      "analysis.root_causes",
      "analysis.cause_description",
      "problem.impacts",
      "knowledge.keywords",
      "knowledge.tags",
      "solution.solution_object",
      "solution.solution_mechanism"
    ],
    "bm25": [
      "problem.failure_objects",
      "problem.phenomena",
      "problem.trigger_conditions",
      "problem.standard_problem_description",
      "problem.problem_description",
      "analysis.failure_mechanisms",
      "analysis.trc",
      "analysis.root_causes",
      "analysis.cause_description",
      "problem.impacts"
    ],
    "embedding": [
      "problem.failure_objects",
      "problem.phenomena",
      "problem.trigger_conditions",
      "problem.standard_problem_description",
      "problem.problem_description",
      "analysis.failure_mechanisms",
      "analysis.trc",
      "analysis.root_causes",
      "analysis.cause_description",
      "problem.impacts"
    ],
    "llm_rerank": [
      "problem.failure_objects",
      "problem.phenomena",
      "problem.trigger_conditions",
      "problem.standard_problem_description",
      "problem.problem_description",
      "analysis.failure_mechanisms",
      "analysis.trc",
      "analysis.root_causes",
      "analysis.cause_description",
      "problem.impacts",
      "knowledge.keywords",
      "knowledge.tags",
      "solution.solution_object",
      "solution.solution_mechanism"
    ]
  },
  "profile_quality": {
    "available_fields": 21,
    "configured_fields": 21,
    "coverage": 1.0,
    "weighted_coverage": 1.0
  },
  "warnings": [],
  "lineage": {
    "raw_query_version": "",
    "field_mapping_config_version": "",
    "normalizer_version": "M7.2-N1",
    "normalization_config_version": "1.0",
    "ai_enricher_version": "M7.2-A1",
    "prompt_version": "1.0",
    "model_provider": "openai_compatible",
    "model_name": "mock-model",
    "standard_builder_version": "M7.2-B1",
    "standard_query_schema_version": "1.0",
    "retrieval_profile_builder_version": "M7.3-P1",
    "retrieval_profile_config_version": "1.0"
  },
  "build_status": "SUCCESS"
}